{
  "$schema": "https://json-schema.org/draft/2020-12/schema",
  "$id": "https://github.com/Lightning-Public/ane-context-ai/schemas/context-package.schema.json",
  "title": "ANE Context Package",
  "type": "object",
  "additionalProperties": false,
  "required": [
    "id",
    "schema_version",
    "created_at",
    "question",
    "evidence",
    "claims",
    "debates",
    "uncertainties",
    "bibliography",
    "retrieval",
    "review"
  ],
  "properties": {
    "id": {"type": "string", "minLength": 1},
    "schema_version": {"const": "0.1.0"},
    "created_at": {"type": "string", "format": "date-time"},
    "question": {
      "type": "object",
      "additionalProperties": false,
      "required": ["original", "normalized", "scope"],
      "properties": {
        "original": {"type": "string", "minLength": 1},
        "normalized": {"type": "string", "minLength": 1},
        "scope": {
          "type": "object",
          "additionalProperties": false,
          "required": ["chronology", "places", "languages", "genres", "notes"],
          "properties": {
            "chronology": {"type": "array", "items": {"type": "string"}},
            "places": {"type": "array", "items": {"type": "string"}},
            "languages": {"type": "array", "items": {"type": "string"}},
            "genres": {"type": "array", "items": {"type": "string"}},
            "notes": {"type": "array", "items": {"type": "string"}}
          }
        }
      }
    },
    "evidence": {
      "type": "array",
      "items": {"$ref": "#/$defs/evidence"}
    },
    "claims": {
      "type": "array",
      "items": {"$ref": "#/$defs/claim"}
    },
    "debates": {
      "type": "array",
      "items": {
        "type": "object",
        "additionalProperties": false,
        "required": ["issue", "positions", "open_questions"],
        "properties": {
          "issue": {"type": "string", "minLength": 1},
          "positions": {
            "type": "array",
            "items": {
              "type": "object",
              "additionalProperties": false,
              "required": ["summary", "evidence_ids"],
              "properties": {
                "summary": {"type": "string", "minLength": 1},
                "evidence_ids": {"type": "array", "items": {"type": "string"}, "uniqueItems": true}
              }
            }
          },
          "open_questions": {"type": "array", "items": {"type": "string"}}
        }
      }
    },
    "uncertainties": {
      "type": "array",
      "items": {
        "type": "object",
        "additionalProperties": false,
        "required": ["target", "kind", "description", "evidence_ids"],
        "properties": {
          "target": {"type": "string", "minLength": 1},
          "kind": {"enum": ["reading", "translation", "identity", "chronology", "provenience", "interpretation", "coverage", "other"]},
          "description": {"type": "string", "minLength": 1},
          "evidence_ids": {"type": "array", "items": {"type": "string"}, "uniqueItems": true}
        }
      }
    },
    "bibliography": {
      "type": "array",
      "items": {
        "type": "object",
        "additionalProperties": false,
        "required": ["id", "citation"],
        "properties": {
          "id": {"type": "string", "minLength": 1},
          "citation": {"type": "string", "minLength": 1},
          "url": {"type": ["string", "null"], "format": "uri"}
        }
      }
    },
    "retrieval": {
      "type": "object",
      "additionalProperties": false,
      "required": ["run_at", "source_manifest_ids", "queries", "software_version"],
      "properties": {
        "run_at": {"type": "string", "format": "date-time"},
        "source_manifest_ids": {"type": "array", "items": {"type": "string"}, "uniqueItems": true},
        "queries": {"type": "array", "items": {"type": "string"}},
        "software_version": {"type": "string", "minLength": 1},
        "model": {"type": ["string", "null"]},
        "prompt_version": {"type": ["string", "null"]}
      }
    },
    "review": {
      "type": "object",
      "additionalProperties": false,
      "required": ["status", "reviewers", "notes"],
      "properties": {
        "status": {"enum": ["unreviewed", "source_checked", "expert_reviewed", "needs_revision"]},
        "reviewers": {"type": "array", "items": {"type": "string"}},
        "notes": {"type": "array", "items": {"type": "string"}}
      }
    }
  },
  "$defs": {
    "evidence": {
      "type": "object",
      "additionalProperties": false,
      "required": ["id", "source", "source_record_id", "stable_url", "locator", "layer", "excerpt", "attribution", "license_manifest_id"],
      "properties": {
        "id": {"type": "string", "minLength": 1},
        "source": {"type": "string", "minLength": 1},
        "source_record_id": {"type": "string", "minLength": 1},
        "stable_url": {"type": "string", "format": "uri"},
        "locator": {"type": "string"},
        "layer": {"enum": ["artifact", "image", "transliteration", "translation", "edition", "secondary"]},
        "excerpt": {"type": "string"},
        "attribution": {"type": "string", "minLength": 1},
        "license_manifest_id": {"type": "string", "minLength": 1}
      }
    },
    "claim": {
      "type": "object",
      "additionalProperties": false,
      "required": ["id", "statement", "status", "supporting_evidence_ids", "challenging_evidence_ids", "confidence", "reasoning"],
      "properties": {
        "id": {"type": "string", "minLength": 1},
        "statement": {"type": "string", "minLength": 1},
        "status": {"enum": ["attested", "derived", "scholarly_interpretation", "model_inference"]},
        "supporting_evidence_ids": {"type": "array", "items": {"type": "string"}, "uniqueItems": true},
        "challenging_evidence_ids": {"type": "array", "items": {"type": "string"}, "uniqueItems": true},
        "confidence": {"enum": ["high", "medium", "low", "unknown"]},
        "reasoning": {"type": "string", "minLength": 1}
      }
    }
  }
}
