{
  "id": "example:synthetic:001",
  "schema_version": "0.1.0",
  "created_at": "2026-08-21T00:00:00Z",
  "question": {
    "original": "합성 예시 문헌은 무엇을 보여 주는가?",
    "normalized": "합성 예시의 명시적 내용과 해석을 구분한다.",
    "scope": {
      "chronology": ["교육용 합성 자료; 실제 연대 없음"],
      "places": [],
      "languages": ["Korean"],
      "genres": ["synthetic example"],
      "notes": ["실제 고대 문헌이나 번역을 인용하지 않는다."]
    }
  },
  "evidence": [
    {
      "id": "ev:001",
      "source": "ANE Context AI synthetic examples",
      "source_record_id": "synthetic:001",
      "stable_url": "https://github.com/Lightning-Public/ane-context-ai/blob/main/examples/context-package.example.json",
      "locator": "evidence[0]",
      "layer": "edition",
      "excerpt": "이 문장은 데이터 구조 검증을 위해 작성된 합성 자료다.",
      "attribution": "ANE Context AI contributors",
      "license_manifest_id": "project:apache-2.0"
    }
  ],
  "claims": [
    {
      "id": "claim:001",
      "statement": "이 패키지는 데이터 구조를 보여 주기 위한 합성 예시다.",
      "status": "attested",
      "supporting_evidence_ids": ["ev:001"],
      "challenging_evidence_ids": [],
      "confidence": "high",
      "reasoning": "증거 문장이 예시의 목적을 직접 명시한다."
    }
  ],
  "debates": [],
  "uncertainties": [
    {
      "target": "historical applicability",
      "kind": "coverage",
      "description": "합성 자료이므로 실제 고대근동 역사에 대한 증거로 사용할 수 없다.",
      "evidence_ids": ["ev:001"]
    }
  ],
  "bibliography": [],
  "retrieval": {
    "run_at": "2026-08-21T00:00:00Z",
    "source_manifest_ids": ["project:apache-2.0"],
    "queries": [],
    "software_version": "0.1.0",
    "model": null,
    "prompt_version": null
  },
  "review": {
    "status": "source_checked",
    "reviewers": ["initial project maintainer"],
    "notes": ["실제 외부 코퍼스 데이터가 포함되지 않았음을 확인함."]
  }
}
